{
  "pressPublishingIntervals": 4,
  "state": "active",
  "rfShoppingChannel": false,
  "pressMagazineType": {
    "squuid": "5be1a6b0-bff8-40db-a254-72d8fa6d3386",
    "name": "Publikumszeitschrift",
    "type": "press-magazine-type",
    "state": "active"
  },
  "pressAsOfDate": "2021",
  "squuid": "5be1a6b1-e4de-44a3-9c88-d57cb4f56cf9",
  "organization": {
    "squuid": "5adf79c8-9f9e-4b59-a86f-7119603efa99",
    "name": "DL",
    "type": "organization"
  },
  "rfStatewide": false,
  "operatedBy": [
    {
      "type": "operate",
      "holder": {
        "name": "VRM GmbH & Co KG",
        "squuid": "5be1a6b6-17dc-47b0-87cc-2b1436e1a864"
      },
      "squuid": "5be1a6b9-2201-45f1-a66b-6ad4df073f80",
      "state": "active"
    }
  ],
  "name": "Unser Rheinhessen",
  "pressEditionsIVW": false,
  "pressDistributionArea": "kreisfreie Stadt Mainz, kreisfreie Stadt Worms, Lk Mainz-Bingen, Lk Alzey-Worms",
  "type": "print",
  "controlDate": "2021-11-17T16:21:45.200Z",
  "pressKind": "regional",
  "onlineOfferType": {
    "squuid": "5be1a6b0-e359-4db0-9c54-8ab7d725db5e",
    "name": "Online Medienangebot",
    "type": "online-offer-type",
    "state": "active"
  },
  "pressEditionsComments": "Verlagsangabe",
  "pressEditionsSold": 10000,
  "pressType": {
    "squuid": "5be1a6b0-8202-4312-8190-cd96a1973f23",
    "name": "Zeitschrift",
    "type": "press-type",
    "state": "active"
  }
}