{
  "state": "active",
  "squuid": "5f901279-2b2a-4ba2-b83c-61ba1e1508bc",
  "organization": {
    "squuid": "5adf79c8-9f9e-4b59-a86f-7119603efa99",
    "name": "DL",
    "type": "organization"
  },
  "operatedBy": [
    {
      "type": "operate",
      "holder": {
        "name": "Radio NRJ GmbH",
        "squuid": "5be1a6b6-fbf8-4b3a-b83b-552f26cc61a6"
      },
      "squuid": "5f9012c2-a323-4172-8ea6-c289bd57e858",
      "state": "active"
    },
    {
      "type": "operate",
      "holder": {
        "name": "Netzwerk Programmanbietergesellschaft mbH Sachsen & Co. Betriebs KG",
        "squuid": "5be1a6b6-181c-4a7c-bbd4-0e8d172c83a3"
      },
      "squuid": "5f9013ab-d7c2-4887-9d04-145fb33506eb",
      "state": "active"
    }
  ],
  "name": "www.energy.de/sachsen",
  "rfPublicPrivate": false,
  "type": "online",
  "controlDate": "2022-10-20T15:55:31.336Z",
  "rfSupervisingAuthority": {
    "squuid": "5adf79c8-9f9e-4b59-a86f-7119603efa99",
    "name": "DL",
    "type": "organization"
  },
  "onlineOfferType": {
    "squuid": "5be1a6b0-e359-4db0-9c54-8ab7d725db5e",
    "name": "Online Medienangebot",
    "type": "online-offer-type",
    "state": "active"
  }
}