{
  "state": "active",
  "rfShoppingChannel": false,
  "squuid": "5be1a6b1-f30e-4eeb-9a90-5a6d0104d238",
  "organization": {
    "squuid": "5adf79c8-9f9e-4b59-a86f-7119603efa99",
    "name": "DL",
    "type": "organization"
  },
  "operatedBy": [
    {
      "type": "operate",
      "holder": {
        "name": "Motor Presse Stuttgart GmbH & Co. KG",
        "squuid": "5be1a6b6-99ba-4261-b3c0-411c299e72ae"
      },
      "squuid": "5be1a6b9-ba84-47a3-a12e-354758ff46c4",
      "state": "active"
    }
  ],
  "name": "www.mountainbike-magazin.de",
  "pressEditionsIVW": false,
  "type": "online",
  "controlDate": "2023-07-13T13:30:53.700Z",
  "onlineOfferType": {
    "squuid": "5be1a6b0-e359-4db0-9c54-8ab7d725db5e",
    "name": "Online Medienangebot",
    "type": "online-offer-type",
    "state": "active"
  },
  "onlineComments": "siehe unter www.outdoorchannel.de"
}