{
  "rfRepresentative": "Mischa Salzmann",
  "state": "active",
  "rfShoppingChannel": false,
  "squuid": "5be1a6b1-0b01-44e3-b9f6-531729ab1822",
  "organization": {
    "squuid": "5b0830c1-8ded-40dd-9d37-2a1a21efaff5",
    "name": "BLM",
    "type": "organization",
    "fullName": "Bayerische Landeszentrale für neue Medien"
  },
  "accessibilityUrl": "https://www.radioeins.de/",
  "rfStatewide": false,
  "operatedBy": [
    {
      "type": "operate",
      "holder": {
        "name": "Funkhaus Coburg GmbH & Co. KG",
        "squuid": "5be1a6b6-a3d5-49fc-bc72-77b1727e864f"
      },
      "squuid": "5be1a6b9-452d-48eb-a991-747a822b07d5",
      "state": "active"
    }
  ],
  "name": "Radio Eins",
  "pressEditionsIVW": false,
  "rfPublicPrivate": false,
  "rfBroadcastStatus": {
    "squuid": "5be1a6ad-6a90-49bf-9940-ae4616389a88",
    "name": "auf Sendung",
    "type": "broadcast-status",
    "state": "active"
  },
  "type": "radio",
  "controlDate": "2025-05-23T15:31:52.548Z",
  "rfSupervisingAuthority": {
    "squuid": "5b0830c1-8ded-40dd-9d37-2a1a21efaff5",
    "name": "BLM",
    "type": "organization",
    "fullName": "Bayerische Landeszentrale für neue Medien"
  },
  "rfLicenseUntil": "30.06.2030",
  "onlineOfferType": {
    "squuid": "5be1a6b0-e359-4db0-9c54-8ab7d725db5e",
    "name": "Online Medienangebot",
    "type": "online-offer-type",
    "state": "active"
  },
  "rfLicensed": "29.10.2024",
  "rfLicenseFrom": "01.07.2025",
  "rfAddress": "Seifartshofstr. 21\n96450\nCoburg\n",
  "accessibilityEmail": "info@radioeins.com"
}