{
  "state": "active",
  "rfShoppingChannel": false,
  "squuid": "5be1a6b1-1fe5-4048-88c8-b554dd91e99e",
  "organization": {
    "squuid": "5adf79c8-9f9e-4b59-a86f-7119603efa99",
    "name": "DL",
    "type": "organization"
  },
  "operatedBy": [
    {
      "type": "operate",
      "holder": {
        "name": "Zentralrat der Juden in Deutschland K. d. รถ. R.",
        "squuid": "5be1a6b6-1c24-453f-8655-277fa3f7bae3"
      },
      "squuid": "5be1a6b9-a159-4cd8-a602-376e2afb985e",
      "state": "active"
    }
  ],
  "name": "www.juedische-allgemeine.de",
  "pressEditionsIVW": false,
  "type": "online",
  "controlDate": "2023-12-15T09:52:57.259Z",
  "onlineOfferType": {
    "squuid": "5be1a6b0-e359-4db0-9c54-8ab7d725db5e",
    "name": "Online Medienangebot",
    "type": "online-offer-type",
    "state": "active"
  }
}