{
  "state": "active",
  "rfStartDate": "28.10.2021",
  "squuid": "61950ed0-c724-42e7-b07b-a7f1ff850222",
  "organization": {
    "squuid": "5b0830f6-6588-43fb-93a8-d824a4663969",
    "name": "LfM",
    "type": "organization",
    "fullName": "Landesanstalt für Medien Nordrhein-Westfalen"
  },
  "rfStatewide": false,
  "operatedBy": [
    {
      "type": "operate",
      "holder": {
        "name": "radio B2 GmbH",
        "squuid": "5be1a6b6-03f0-4d87-841b-249e957d36cc"
      },
      "squuid": "61950fe9-b7b8-49e3-a853-63cc2153330f",
      "state": "active"
    }
  ],
  "name": "Schlager Radio - Das Schlager Radio",
  "rfPublicPrivate": false,
  "rfBroadcastStatus": {
    "squuid": "5be1a6ad-6a90-49bf-9940-ae4616389a88",
    "name": "auf Sendung",
    "type": "broadcast-status",
    "state": "active"
  },
  "type": "radio",
  "rfSupervisingAuthority": {
    "squuid": "5b0830f6-6588-43fb-93a8-d824a4663969",
    "name": "LfM",
    "type": "organization",
    "fullName": "Landesanstalt für Medien Nordrhein-Westfalen"
  },
  "rfLicenseUntil": "unbefristet",
  "rfLicensed": "27.05.2021",
  "rfLicenseFrom": "LfM"
}