{
  "state": "active",
  "rfShoppingChannel": false,
  "squuid": "5be1a6b1-ebdd-4497-8733-7e68f9a1838f",
  "organization": {
    "squuid": "5adf79c9-1b57-44c7-a29d-9130ab140fa9",
    "name": "GGS",
    "type": "organization",
    "fullName": "Gemeinsame Geschaeftsstelle"
  },
  "rfStatewide": false,
  "operatedBy": [
    {
      "type": "operate",
      "holder": {
        "name": "Appiah, George",
        "squuid": "5be1a6b6-a3af-409f-a286-bd5d0ce6f39d"
      },
      "squuid": "5be1a6b9-b3c5-4528-abd7-2f133bb3d793",
      "state": "active"
    }
  ],
  "name": "Best Radio",
  "pressEditionsIVW": false,
  "rfPublicPrivate": false,
  "type": "radio",
  "description": "Der Sendestart ist noch offen.",
  "onlineOfferType": {
    "squuid": "5be1a6b0-e359-4db0-9c54-8ab7d725db5e",
    "name": "Online Medienangebot",
    "type": "online-offer-type",
    "state": "active"
  }
}