{
  "pressPublishingIntervals": 12,
  "state": "active",
  "pressMagazineType": {
    "squuid": "5be1a6b0-bff8-40db-a254-72d8fa6d3386",
    "name": "Publikumszeitschrift",
    "type": "press-magazine-type",
    "state": "active"
  },
  "pressAsOfDate": "II/21",
  "squuid": "5bfbdf4c-d536-462c-8b55-002f3df8a601",
  "organization": {
    "squuid": "5adf79c8-9f9e-4b59-a86f-7119603efa99",
    "name": "DL",
    "type": "organization"
  },
  "operatedBy": [
    {
      "type": "operate",
      "holder": {
        "name": "Solutions by Handelsblatt Media Group GmbH",
        "squuid": "5be1a6b6-5bb1-481a-96c5-3f9fd14dce4b"
      },
      "squuid": "5bfbdf98-473e-4f7b-903e-d9830fb358bd",
      "state": "active"
    }
  ],
  "name": "Creditreform",
  "pressEditionsIVW": true,
  "rfPublicPrivate": false,
  "pressDistributionArea": "bundesweit",
  "type": "print",
  "controlDate": "2021-09-27T15:56:34.656Z",
  "rfSupervisingAuthority": {
    "squuid": "5adf79c8-9f9e-4b59-a86f-7119603efa99",
    "name": "DL",
    "type": "organization"
  },
  "pressKind": "Wirtschaft",
  "pressEditionsSold": 116247,
  "pressType": {
    "squuid": "5be1a6b0-8202-4312-8190-cd96a1973f23",
    "name": "Zeitschrift",
    "type": "press-type",
    "state": "active"
  }
}