{
  "state": "active",
  "onlineAsOfDateIVW": "3/23",
  "squuid": "61f29e84-2e79-4464-b52a-5b58606cef34",
  "organization": {
    "squuid": "5adf79c8-9f9e-4b59-a86f-7119603efa99",
    "name": "DL",
    "type": "organization"
  },
  "operatedBy": [
    {
      "type": "operate",
      "holder": {
        "name": "Deutscher Fachverlag GmbH",
        "squuid": "5be1a6b6-ed5e-4d40-b881-8bccea08d38d"
      },
      "squuid": "61f29eac-c61d-402b-842c-00600fa873e4",
      "state": "active"
    }
  ],
  "name": "www.agrarzeitung.de",
  "rfPublicPrivate": false,
  "type": "online",
  "controlDate": "2023-04-26T14:31:00.209Z",
  "onlineIVWPI": 665000,
  "rfSupervisingAuthority": {
    "squuid": "5adf79c8-9f9e-4b59-a86f-7119603efa99",
    "name": "DL",
    "type": "organization"
  },
  "onlineOfferType": {
    "squuid": "5be1a6b0-e359-4db0-9c54-8ab7d725db5e",
    "name": "Online Medienangebot",
    "type": "online-offer-type",
    "state": "active"
  },
  "onlineVisitsIVW": 263300,
  "onlineComments": "IVW-gepr√ºftes Angebot"
}