{
  "pressPublishingIntervals": 12,
  "state": "active",
  "pressMagazineType": {
    "squuid": "5be1a6b0-bff8-40db-a254-72d8fa6d3386",
    "name": "Publikumszeitschrift",
    "type": "press-magazine-type",
    "state": "active"
  },
  "pressAsOfDate": "III/24",
  "squuid": "5c657b72-8e51-47d0-aa94-ab4a5fd890c5",
  "organization": {
    "squuid": "5adf79c8-9f9e-4b59-a86f-7119603efa99",
    "name": "DL",
    "type": "organization"
  },
  "operatedBy": [
    {
      "type": "operate",
      "holder": {
        "name": "SDZ Druck und Medien GmbH",
        "squuid": "5be1a6b6-1d7f-4bb0-91e5-6ee4accea502"
      },
      "squuid": "5c657bc6-b248-45f7-9099-fd6265d5302e",
      "state": "active"
    }
  ],
  "name": "Wirtschaft regional",
  "pressEditionsIVW": true,
  "rfPublicPrivate": false,
  "pressDistributionArea": "Ostalbkreis",
  "type": "print",
  "pressEditionsEpaper": 0,
  "controlDate": "2025-06-14T11:54:12.904Z",
  "rfSupervisingAuthority": {
    "squuid": "5adf79c8-9f9e-4b59-a86f-7119603efa99",
    "name": "DL",
    "type": "organization"
  },
  "pressKind": "Regional",
  "pressEditionsComments": "",
  "pressEditionsSold": 9454,
  "pressType": {
    "squuid": "5be1a6b0-8202-4312-8190-cd96a1973f23",
    "name": "Zeitschrift",
    "type": "press-type",
    "state": "active"
  }
}