{
  "rfRepresentative": "Konrad Schwingenstein",
  "state": "active",
  "rfShoppingChannel": false,
  "squuid": "5be1a6b1-f531-4b55-917e-ae293f87b00c",
  "marketReach": 0.1,
  "organization": {
    "squuid": "5b0830c1-8ded-40dd-9d37-2a1a21efaff5",
    "name": "BLM",
    "type": "organization",
    "fullName": "Bayerische Landeszentrale für neue Medien"
  },
  "accessibilityUrl": "https://www.egofm.de/",
  "rfStatewide": false,
  "operatedBy": [
    {
      "type": "operate",
      "holder": {
        "name": "Radio Next Generation GmbH & Co. KG",
        "squuid": "5be1a6b6-73c7-40c3-9f6c-36bdb642bc5d"
      },
      "squuid": "5be1a6b9-55a8-42f2-9a35-5b713d6f1701",
      "state": "active"
    }
  ],
  "name": "egoFM (BLM)",
  "pressEditionsIVW": false,
  "rfPublicPrivate": false,
  "type": "radio",
  "rfSupervisingAuthority": {
    "squuid": "5b0830c1-8ded-40dd-9d37-2a1a21efaff5",
    "name": "BLM",
    "type": "organization",
    "fullName": "Bayerische Landeszentrale für neue Medien"
  },
  "rfLicenseUntil": "30.09.2020",
  "onlineOfferType": {
    "squuid": "5be1a6b0-e359-4db0-9c54-8ab7d725db5e",
    "name": "Online Medienangebot",
    "type": "online-offer-type",
    "state": "active"
  },
  "rfLicensed": "24.05.2016",
  "rfLicenseFrom": "24.05.2016",
  "rfAddress": "Leopoldstr. 254\t\n80807\t\nMünchen\n",
  "accessibilityEmail": "info@egofm.de"
}