{
  "state": "active",
  "squuid": "5f9172ce-29d6-4d68-a079-75ef7a13a9ca",
  "organization": {
    "squuid": "5adf79c8-9f9e-4b59-a86f-7119603efa99",
    "name": "DL",
    "type": "organization"
  },
  "operatedBy": [
    {
      "type": "operate",
      "holder": {
        "name": "Norddeutscher Rundfunk (NDR)",
        "squuid": "5be1a6b6-f139-4f07-95d0-bf1060f47ff8"
      },
      "squuid": "5f917474-1849-4679-8122-ea679754e9d8",
      "state": "active"
    }
  ],
  "name": "www.n-joy.de",
  "rfPublicPrivate": false,
  "type": "online",
  "controlDate": "2024-07-18T10:35:17.544Z",
  "rfSupervisingAuthority": {
    "squuid": "5adf79c8-9f9e-4b59-a86f-7119603efa99",
    "name": "DL",
    "type": "organization"
  },
  "onlineOfferType": {
    "squuid": "5be1a6b0-e359-4db0-9c54-8ab7d725db5e",
    "name": "Online Medienangebot",
    "type": "online-offer-type",
    "state": "active"
  }
}