{
  "state": "archived",
  "rfShoppingChannel": false,
  "squuid": "5be1a6b1-b95e-4e6a-bdaa-1a04449ba5db",
  "organization": {
    "squuid": "5adf79c8-9f9e-4b59-a86f-7119603efa99",
    "name": "DL",
    "type": "organization"
  },
  "name": "www.absolventa.de",
  "pressEditionsIVW": false,
  "type": "online",
  "controlDate": "2019-07-01T15:28:02.752Z",
  "onlineOfferType": {
    "squuid": "5be1a6b0-e359-4db0-9c54-8ab7d725db5e",
    "name": "Online Medienangebot",
    "type": "online-offer-type",
    "state": "active"
  }
}