{
  "state": "active",
  "onlineAsOfDateIVW": "7/22",
  "squuid": "5c4f01c7-c9e8-4359-9900-00109fb5d657",
  "marketReach": 0.09753875056836028,
  "organization": {
    "squuid": "5adf79c8-9f9e-4b59-a86f-7119603efa99",
    "name": "DL",
    "type": "organization"
  },
  "operatedBy": [
    {
      "type": "operate",
      "holder": {
        "name": "Promipool GmbH",
        "squuid": "5c4f01d3-f83a-4f27-9a0e-959fee8b5b22"
      },
      "squuid": "5c4f0226-b05d-46ce-a109-e978696176bd",
      "state": "active"
    }
  ],
  "name": "www.promipool.de",
  "rfPublicPrivate": false,
  "type": "online",
  "controlDate": "2022-12-05T14:10:17.423Z",
  "onlineIVWPI": 8769300,
  "onlineAsOfDateAGOF": "5/22",
  "rfSupervisingAuthority": {
    "squuid": "5adf79c8-9f9e-4b59-a86f-7119603efa99",
    "name": "DL",
    "type": "organization"
  },
  "onlineOfferType": {
    "squuid": "5be1a6b0-e359-4db0-9c54-8ab7d725db5e",
    "name": "Online Medienangebot",
    "type": "online-offer-type",
    "state": "active"
  },
  "onlineVisitsIVW": 3773200,
  "onlineAGOF": 3210000
}