{
  "state": "active",
  "onlineAsOfDateIVW": "",
  "rfShoppingChannel": false,
  "squuid": "5be1a6b1-2570-4bee-a70e-98baa1f06b47",
  "marketReach": 0.16133904196008153,
  "organization": {
    "squuid": "5adf79c8-9f9e-4b59-a86f-7119603efa99",
    "name": "DL",
    "type": "organization"
  },
  "operatedBy": [
    {
      "type": "operate",
      "holder": {
        "name": "Verlag Dierichs GmbH & Co. KG",
        "squuid": "5be1a6b6-6af6-4d18-aba5-e87517df7d54"
      },
      "squuid": "5be1a6b9-9f8f-4bbc-a765-02bd6b52f98c",
      "state": "active"
    },
    {
      "type": "operate",
      "holder": {
        "name": "Ippen Digital GmbH & Co KG",
        "squuid": "5be1a6b6-7ddd-47b0-a68d-5da7195c4eff"
      },
      "squuid": "5be1a6b9-36d1-4011-9aac-6e27f8c6f234",
      "state": "active"
    }
  ],
  "name": "www.hna.de",
  "pressEditionsIVW": false,
  "type": "online",
  "controlDate": "2023-07-10T14:52:24.715Z",
  "onlineIVWPI": 0,
  "onlineAsOfDateAGOF": "",
  "onlineOfferType": {
    "squuid": "5be1a6b0-e359-4db0-9c54-8ab7d725db5e",
    "name": "Online Medienangebot",
    "type": "online-offer-type",
    "state": "active"
  },
  "onlineVisitsIVW": 0,
  "onlineComments": "siehe unter www.ippen.media",
  "onlineAGOF": 0
}