{
  "state": "active",
  "rfShoppingChannel": false,
  "rfStartDate": "30.08.1997 (EinsExtra), 30.04.2012 (tagesschau24)",
  "rfFreePay": true,
  "squuid": "5be1a6b1-1c6d-45d4-b8c7-baaa29a723be",
  "marketReach": 0.3,
  "organization": {
    "squuid": "5adf79c7-7ca3-4d7a-939c-d5a256934b27",
    "name": "KEK",
    "type": "organization"
  },
  "accessibilityUrl": "https://programm.ard.de/TV/tagesschau24/Startseite",
  "rfStatewide": true,
  "operatedBy": [
    {
      "type": "operate",
      "holder": {
        "name": "Arbeitsgemeinschaft der öffentlich-rechtlichen Rundfunkanstalten der Bundesrepublik Deutschland (ARD)",
        "squuid": "5be1a6b6-c5dc-4a3d-ad7b-deaabd587214"
      },
      "squuid": "5be1a6b9-353f-4b10-bd9e-7fbe432bc0f4",
      "state": "active"
    }
  ],
  "name": "tagesschau24",
  "pressEditionsIVW": false,
  "rfPublicPrivate": true,
  "rfBroadcastStatus": {
    "squuid": "5be1a6ad-6a90-49bf-9940-ae4616389a88",
    "name": "auf Sendung",
    "type": "broadcast-status",
    "state": "active"
  },
  "rfDirector": "Lutz Marmor (NDR)",
  "type": "tv",
  "rfCategory": {
    "squuid": "5be1a6ad-5d06-4b68-96e4-33a2746127f9",
    "name": "Spartenprogramm (Nachrichten)",
    "type": "program-category",
    "state": "active"
  },
  "description": "Digitales Fernsehspartenprogramm der ARD. Der Schwerpunkt liegt auf der Ausstrahlung von Informations- und Nachrichtensendungen, Reportagen, Dokumentationen und Gesprächssendungen. Die Leitung von tagesschau24 innerhalb der ARD liegt beim Norddeutschen Rundfunk.",
  "onlineOfferType": {
    "squuid": "5be1a6b0-e359-4db0-9c54-8ab7d725db5e",
    "name": "Online Medienangebot",
    "type": "online-offer-type",
    "state": "active"
  },
  "platformOperators": [
    {
      "squuid": "5be1a6b0-d549-4f5a-aba3-fcf19dc2d9cd",
      "name": "Vodafone Kabel Deutschland GmbH",
      "type": "platform-operator",
      "distributionType": {
        "squuid": "5be1a6b0-6010-48d9-8f4c-8d0a8329d4e6",
        "name": "Kabel",
        "type": "distribution-type"
      },
      "state": "active"
    },
    {
      "squuid": "5be1a6b0-14bf-4535-b607-ef81816a7173",
      "name": "Deutsche Telekom GmbH / Magenta TV",
      "type": "platform-operator",
      "distributionType": {
        "squuid": "5be1a6b0-951c-4614-9f9c-49bd5d814a60",
        "name": "IPTV",
        "type": "distribution-type"
      },
      "state": "active"
    },
    {
      "squuid": "5be1a6b0-2fa4-4160-a33b-8b51c00997a4",
      "name": "Vodafone Kabel Deutschland GmbH (GIGA TV)",
      "type": "platform-operator",
      "distributionType": {
        "squuid": "5be1a6b0-951c-4614-9f9c-49bd5d814a60",
        "name": "IPTV",
        "type": "distribution-type"
      },
      "state": "active"
    },
    {
      "squuid": "5be1a6b0-ec5e-4d1d-aeab-25f09a97bf67",
      "name": "Tele Columbus AG",
      "type": "platform-operator",
      "distributionType": {
        "squuid": "5be1a6b0-6010-48d9-8f4c-8d0a8329d4e6",
        "name": "Kabel",
        "type": "distribution-type"
      },
      "state": "active"
    },
    {
      "squuid": "5be1a6b0-24b4-4d13-8a22-0c8d2f905c50",
      "name": "Astra Deutschland GmbH",
      "type": "platform-operator",
      "distributionType": {
        "squuid": "5be1a6b0-e8af-46c2-aeeb-fb68d2d314b0",
        "name": "Satellit",
        "type": "distribution-type"
      },
      "state": "active"
    },
    {
      "squuid": "5be1a6b0-4f77-4a73-90db-f4170510c758",
      "name": "Media Broadcast GmbH / freenet TV",
      "type": "platform-operator",
      "distributionType": {
        "squuid": "5be1a6b0-4dbe-45ef-ab98-fcd1599e57f0",
        "name": "Terrestrik",
        "type": "distribution-type"
      },
      "state": "active"
    },
    {
      "squuid": "5be1a6b0-700d-4668-b750-23119f199d9a",
      "name": "Live-Stream/Senderseite",
      "type": "platform-operator",
      "distributionType": {
        "squuid": "5be1a6b0-eeba-4517-af4c-ee038a5da882",
        "name": "OTT",
        "type": "distribution-type"
      },
      "state": "active"
    },
    {
      "squuid": "5be1a6b0-ad9e-4670-b9d9-71ea6517791a",
      "name": "Zattoo",
      "type": "platform-operator",
      "distributionType": {
        "squuid": "5be1a6b0-eeba-4517-af4c-ee038a5da882",
        "name": "OTT",
        "type": "distribution-type"
      },
      "state": "active"
    },
    {
      "squuid": "5be1a6b0-2a80-4b57-9a14-77c549d0ed24",
      "name": "Prime Video (Amazon Instant Video Germany GmbH)",
      "type": "platform-operator",
      "distributionType": {
        "squuid": "5be1a6b0-eeba-4517-af4c-ee038a5da882",
        "name": "OTT",
        "type": "distribution-type"
      },
      "state": "active"
    }
  ],
  "rfAddress": "Norddeutscher Rundfunk, Hugh-Greene-Weg 1, 22529 Hamburg",
  "accessibilityEmail": "tagesschau24@ard-poc.de",
  "languages": [
    {
      "squuid": "5be1a6ae-6473-44d1-97eb-d7ff6e27a248",
      "name": "Deutsch",
      "type": "language",
      "state": "active"
    }
  ]
}