{
  "rfRepresentative": "Maximilian Krug",
  "state": "active",
  "rfShoppingChannel": false,
  "rfStartDate": "27.09.2006",
  "squuid": "5be1a6b1-1ac3-4d56-a65e-5559d9bb5bb0",
  "organization": {
    "squuid": "5b0830e0-995b-4e41-bc1e-678fbd483756",
    "name": "LFK",
    "type": "organization",
    "fullName": "Landesanstalt für Kommunikation Baden-Württemberg"
  },
  "accessibilityUrl": "https://www.hitradio-msone.de/",
  "rfStatewide": true,
  "operatedBy": [
    {
      "type": "operate",
      "holder": {
        "name": "Hitradio MS One Programmanbieter GmbH",
        "squuid": "5be1a6b6-ef73-435b-99f7-865ed5ae0848"
      },
      "squuid": "5be1a6b9-d8c3-4daf-9d2f-f8044f932f5b",
      "state": "active"
    }
  ],
  "name": "Hitradio MS One",
  "pressEditionsIVW": false,
  "rfPublicPrivate": false,
  "rfBroadcastStatus": {
    "squuid": "5be1a6ad-6a90-49bf-9940-ae4616389a88",
    "name": "auf Sendung",
    "type": "broadcast-status",
    "state": "active"
  },
  "type": "radio",
  "controlDate": "2021-04-27T07:42:24.597Z",
  "rfCategory": {
    "squuid": "5be1a6ad-063c-4208-94e1-5216fef7a724",
    "name": "Vollprogramm",
    "type": "program-category",
    "state": "active"
  },
  "rfSupervisingAuthority": {
    "squuid": "5b0830e0-995b-4e41-bc1e-678fbd483756",
    "name": "LFK",
    "type": "organization",
    "fullName": "Landesanstalt für Kommunikation Baden-Württemberg"
  },
  "description": "bundesweites Hörfunkvollprogramm",
  "onlineOfferType": {
    "squuid": "5be1a6b0-e359-4db0-9c54-8ab7d725db5e",
    "name": "Online Medienangebot",
    "type": "online-offer-type",
    "state": "active"
  },
  "accessibilityEmail": "info@hitradio-msone.de"
}