{
  "state": "active",
  "rfShoppingChannel": false,
  "squuid": "5be1a6b1-0760-49c2-ad2c-d2ee0b7d9ffe",
  "organization": {
    "squuid": "5adf79c9-1b57-44c7-a29d-9130ab140fa9",
    "name": "GGS",
    "type": "organization",
    "fullName": "Gemeinsame Geschaeftsstelle"
  },
  "rfStatewide": false,
  "operatedBy": [
    {
      "type": "operate",
      "holder": {
        "name": "Funk & Fernsehen Nordwestdeutschland GmbH & Co. KG",
        "squuid": "5be1a6b6-6d31-40f9-81d9-39e930c9b6cb"
      },
      "squuid": "5be1a6b9-2750-493a-8f46-295b63cb3d3f",
      "state": "active"
    }
  ],
  "name": "PEPPERMINT fm",
  "pressEditionsIVW": false,
  "rfPublicPrivate": false,
  "type": "radio",
  "description": "Webradio",
  "onlineOfferType": {
    "squuid": "5be1a6b0-e359-4db0-9c54-8ab7d725db5e",
    "name": "Online Medienangebot",
    "type": "online-offer-type",
    "state": "active"
  }
}