{
  "matchedNames": [
    "Radio Galaxy"
  ],
  "rfRepresentative": "Alexander Koller",
  "state": "active",
  "rfShoppingChannel": false,
  "squuid": "5be1a6b1-edf8-40c9-bb8e-efbe20edca3b",
  "marketReach": 0.1,
  "organization": {
    "squuid": "5b0830c1-8ded-40dd-9d37-2a1a21efaff5",
    "name": "BLM",
    "type": "organization",
    "fullName": "Bayerische Landeszentrale für neue Medien"
  },
  "accessibilityUrl": "https://www.galaxy.bayern/",
  "rfStatewide": false,
  "operatedBy": [
    {
      "type": "operate",
      "holder": {
        "name": "Digitaler Rundfunk Bayern GmbH & Co. KG",
        "squuid": "5be1a6b6-a007-40ef-96ec-632d31222118"
      },
      "squuid": "5be1a6b9-0366-4263-94a4-76f3e76ff953",
      "state": "active"
    }
  ],
  "name": "Galaxy Bayern",
  "pressEditionsIVW": false,
  "rfPublicPrivate": false,
  "type": "radio",
  "rfSupervisingAuthority": {
    "squuid": "5b0830c1-8ded-40dd-9d37-2a1a21efaff5",
    "name": "BLM",
    "type": "organization",
    "fullName": "Bayerische Landeszentrale für neue Medien"
  },
  "onlineOfferType": {
    "squuid": "5be1a6b0-e359-4db0-9c54-8ab7d725db5e",
    "name": "Online Medienangebot",
    "type": "online-offer-type",
    "state": "active"
  },
  "rfAddress": "Ulmenstr. 52h\n90443\nNürnberg\n",
  "accessibilityEmail": "feedback@radio-galaxy.de"
}