{
  "state": "active",
  "squuid": "5f195bd4-a5fe-4012-ba92-c734f03ee091",
  "organization": {
    "squuid": "5adf79c8-9f9e-4b59-a86f-7119603efa99",
    "name": "DL",
    "type": "organization"
  },
  "operatedBy": [
    {
      "type": "operate",
      "holder": {
        "name": "on air new media GmbH",
        "squuid": "5f195c89-5645-456a-b531-f333682b866b"
      },
      "squuid": "5f195c9b-422b-4be6-bc0b-14aa26cfd605",
      "state": "active"
    }
  ],
  "name": "www.noa4.de",
  "rfPublicPrivate": false,
  "type": "online",
  "controlDate": "2024-01-04T09:58:48.838Z",
  "rfSupervisingAuthority": {
    "squuid": "5adf79c8-9f9e-4b59-a86f-7119603efa99",
    "name": "DL",
    "type": "organization"
  },
  "onlineOfferType": {
    "squuid": "5be1a6b0-e359-4db0-9c54-8ab7d725db5e",
    "name": "Online Medienangebot",
    "type": "online-offer-type",
    "state": "active"
  }
}