{
  "pressPublishingIntervals": 52,
  "state": "active",
  "squuid": "6436b3b3-24ea-44d0-a03a-e976c0b82815",
  "organization": {
    "squuid": "5adf79c8-9f9e-4b59-a86f-7119603efa99",
    "name": "DL",
    "type": "organization"
  },
  "operatedBy": [
    {
      "type": "operate",
      "holder": {
        "name": "Funke Harz Kurier GmbH",
        "squuid": "6082ce0d-e395-446b-a145-7b7adbf5a7b2"
      },
      "squuid": "6436b3df-496c-43dd-8f31-86c1a514b09a",
      "state": "active"
    },
    {
      "type": "operate",
      "holder": {
        "name": "Funke Zentralredaktion GmbH ",
        "squuid": "5c5d6043-ab67-49ca-8a91-21c28160b7e0"
      },
      "squuid": "6436b3e7-428f-49b5-92dc-d0116ab26270",
      "state": "active"
    }
  ],
  "name": "Harz Kurier am Sonntag",
  "pressEditionsIVW": false,
  "rfPublicPrivate": false,
  "pressDistributionArea": "nur als ePaper",
  "type": "print",
  "controlDate": "2023-04-12T13:35:58.625Z",
  "rfSupervisingAuthority": {
    "squuid": "5adf79c8-9f9e-4b59-a86f-7119603efa99",
    "name": "DL",
    "type": "organization"
  },
  "pressType": {
    "squuid": "5be1a6b0-4e68-459d-a5ee-da3974114c2a",
    "name": "E-Paper",
    "type": "press-type",
    "state": "active"
  }
}