{
  "rfRepresentative": "Hans-Dieter Hillmoth",
  "state": "active",
  "rfShoppingChannel": false,
  "rfStartDate": "01.09.2000",
  "squuid": "5be1a6b1-0810-4788-a07b-b81c7cda7dcc",
  "marketReach": 0.1,
  "organization": {
    "squuid": "5b0830d3-6eed-43cd-8b57-958937d68a9f",
    "name": "LPR Hessen",
    "type": "organization",
    "fullName": "Hessische Landesanstalt für privaten Rundfunk und neue Medien"
  },
  "accessibilityUrl": "https://www.harmonyfm.de/index.html",
  "rfStatewide": false,
  "operatedBy": [
    {
      "type": "operate",
      "holder": {
        "name": "RADIO/TELE FFH GmbH & Co. Betriebs-KG",
        "squuid": "5be1a6b6-2ff0-4d6a-87d5-4a0611385f4f"
      },
      "squuid": "5be1a6b9-12c3-4291-8841-bd57b198368d",
      "state": "active"
    }
  ],
  "name": "Harmony.fm",
  "pressEditionsIVW": false,
  "rfPublicPrivate": false,
  "rfBroadcastStatus": {
    "squuid": "5be1a6ad-6a90-49bf-9940-ae4616389a88",
    "name": "auf Sendung",
    "type": "broadcast-status",
    "state": "active"
  },
  "type": "radio",
  "rfSupervisingAuthority": {
    "squuid": "5b0830d3-6eed-43cd-8b57-958937d68a9f",
    "name": "LPR Hessen",
    "type": "organization",
    "fullName": "Hessische Landesanstalt für privaten Rundfunk und neue Medien"
  },
  "description": "Webradio",
  "rfLicenseUntil": "29.02.2025",
  "onlineOfferType": {
    "squuid": "5be1a6b0-e359-4db0-9c54-8ab7d725db5e",
    "name": "Online Medienangebot",
    "type": "online-offer-type",
    "state": "active"
  },
  "rfLicensed": "10.12.2018",
  "rfLicenseFrom": "10.12.2018",
  "rfAddress": "Radio/Tele FFH GmbH & Co. Betriebs-KG\nFFH-Platz 1\n61111 Bad Vilbel",
  "accessibilityEmail": "info@harmonyfm.de"
}